{
  "format": "dgos-app/v1",
  "appId": "com.dgos.test.fr002.1bfe15c6",
  "version": "1.0.0",
  "build": 1,
  "releaseChannel": "stable",
  "minRuntimeVersion": "1.0.0",
  "dataVersion": 1,
  "name": {
    "zh-CN": "FR-002 验证包",
    "en-US": "FR-002 Test Package"
  },
  "description": {
    "zh-CN": "完整生命周期验证测试包",
    "en-US": "Complete lifecycle validation test package"
  },
  "category": "development",
  "icon": "icon.svg",
  "defaultWindow": {
    "width": 800,
    "height": 600
  },
  "entrypoints": {
    "web": "index.html"
  },
  "permissions": [
    "dgos.system.context.read"
  ],
  "capabilityAllowlist": [
    "dgos.system.context.read"
  ],
  "trustLevel": "standard",
  "uninstallPolicy": "user-removable",
  "backgroundPolicy": "release"
}